{
  "$schema": "./scenario.schema.json",
  "schemaVersion": "1.0.0",
  "id": "v1-original",
  "parentVersion": null,
  "createdDate": "2026-10-30",
  "status": "offline_proposal_pending_reconciliation_and_review",
  "currency": "USD",
  "activationAllowed": false,
  "references": {
    "baseline": "../../home2smart.v1.json",
    "baselineDataSha256": "e976cb48076c37e76d54e86125e41ea28b64bad9dc288aa43a71ada7bb33bf28",
    "equipment": "../../equipment.v1.json",
    "cameraConfiguration": "../../residential-cameras.v1.json",
    "cameraAlgorithm": "../../camera-recommendations.cjs"
  },
  "equipmentCostSnapshots": [
    {"equipmentId": "onn_fixed_32_86", "productId": "777842123", "catalogField": "costAssumption.amount", "amount": 24.88, "checkedDate": "2026-10-30"},
    {"equipmentId": "eufy_solocam_s220", "productId": "T8134121", "catalogField": "costAssumption.amount", "amount": 99.99, "checkedDate": "2026-10-30"}
  ],
  "tv": {
    "includedMountEquipmentId": "onn_fixed_32_86",
    "includedMountTierGroup": "residentialWithStandardFixedMount",
    "customerMountTierGroup": "residentialInstallationOnly",
    "discounts": {"basis": "marginal_highest_base_price_first", "percentsByPosition": [0, 10, 15], "beyondSchedule": "custom_quote"},
    "exampleTier": {"minInches": 56, "maxInches": 65},
    "examples": [{"quantity": 1, "revenue": 179}, {"quantity": 2, "revenue": 340.10}, {"quantity": 3, "revenue": 492.25}]
  },
  "cameras": {
    "standardEquipmentId": "eufy_solocam_s220",
    "baselineTierGroup": "residentialEquipmentIncluded",
    "packages": [
      {"quantity": 2, "price": 499, "baselineQuantityReference": 2},
      {"quantity": 3, "price": 699, "baselineQuantityReference": null},
      {"quantity": 4, "price": 899, "baselineQuantityReference": 4}
    ],
    "otherConfigurations": "recommendation_algorithm_and_custom_quote",
    "linkedCameraCostBasis": "current_verified_algorithm_procurement_and_material_lines"
  },
  "assumptions": {
    "materialsTaxPercent": 8,
    "materialsTaxBasis": "equipment_and_supplies_excluding_travel_shipping_and_customer_service_revenue",
    "processingPercent": 3,
    "serviceReservePercent": 5,
    "serviceReserveBasis": "customer_revenue_before_commission",
    "commissionPercent": 55,
    "commissionScenarios": [50, 55, 60],
    "commissionBasis": "positive_contribution_after_modeled_direct_expenses",
    "minimumCompanyMarginPercent": 18,
    "ownerInstallationLaborDeduction": false,
    "allowances": {
      "tvSuppliesPerTv": {"amount": 3, "notes": "Existing extra_tv_consumables catalog estimate per TV; not an approved camera allowance."},
      "cameraSuppliesPerCamera": {"amount": null, "notes": "No approved camera consumable allowance supplied."},
      "solarChargingPerCamera": {"amount": null, "notes": "Verify compatible included/available charging supplies; do not assume zero."},
      "travelPerVisit": {"amount": null, "notes": "Enter site-specific travel expense, including any expected travel costs."},
      "shippingPerVisit": {"amount": null, "notes": "Verify supplier shipping charges; free shipping requires documented zero."}
    },
    "overhead": {"monthlyAmount": null, "notes": "Enter monthly operating overhead separately; never deduct owner installation labor."},
    "reinvestmentPercent": 25,
    "ownerDistributionPercent": 75,
    "ownerCount": 3,
    "distributionBasis": "positive_company_contribution_after_separately_entered_monthly_overhead",
    "notes": "Planning assumptions only. Taxability requires local verification. Service reserve is retained but unavailable for modeled commission/distributions; no second reserve deduction. No technician payroll or owner installation labor is deducted."
  },
  "changeNotes": "Original requested residential offer experiment. Not approved, not active, not a baseline override."
}
